numDoc,controle,autor,matricula,dataPronunciamento,resumo,legislatura,dataSessao
000000373,46721,DEPUTADO LÉO PORTELA,16019,2021-08-17 10:00:00,"Declara posição favorável ao requerimento que solicita o adiamento da
votação do projeto de lei que dispõe sobre a prestação de serviço
fretado de transporte rodoviário intermunicipal e metropolitano de
pessoas.",19,2021-08-17 10:00:00
000000374,46722,DEPUTADA LAURA SERRANO,26165,2021-08-17 10:00:00,"Declara posição favorável ao requerimento que solicita o adiamento da
votação do projeto de lei que dispõe sobre a prestação de serviço
fretado de transporte rodoviário intermunicipal e metropolitano de
pessoas.",19,2021-08-17 10:00:00
000000375,43723,DEPUTADO ALENCAR DA SILVEIRA JR.,7752,2021-08-17 10:00:00,"Comenta a solicitação de adiamento da votação do projeto de lei que
dispõe sobre a prestação de serviço fretado de transporte rodoviário
intermunicipal e metropolitano de pessoas. Informa que, regimentalmente,
o projeto não poderia mais ser alterado em 1º turno, podendo ser
discutido e aprimorado no 2º turno.",19,2021-08-17 10:00:00
000000376,46724,DEPUTADO CÁSSIO SOARES,18848,2021-08-17 10:00:00,"Declara posição favorável ao requerimento que solicita a inversão da
preferência na votação do projeto de lei que institui o Dia do Policial
Militar Feminino, de modo que o projeto original seja apreciado em
primeiro lugar.",19,2021-08-17 10:00:00
000000377,46725,DEPUTADO DUARTE BECHIR,17919,2021-08-17 10:00:00,"Solicita apoio ao projeto de lei de sua que autoriza o Poder Executivo a
doar ao Município de Santa Rita do Jacutinga o imóvel que especifica
(destinação: construção de um ginásio poliesportivo).",19,2021-08-17 10:00:00
000000378,46726,DEPUTADO BARTÔ,26144,2021-08-17 10:00:00,"Justifica voto em branco ao projeto de lei que institui o Dia do
Policial Militar Feminino; e ao projeto de lei que declara patrimônio
histórico, artístico e cultural do Estado o modo de feitura dos tapetes
ornamentais da Festa de Corpus Christi dos municípios mineiros.
Justifica voto contrário ao projeto de lei que estabelece normas para a
adoção de material didático-escolar pelos estabelecimentos de educação
básica da rede particular, e a lei que proíbe a cobrança de taxa ou
mensalidade em escola pública; ao projeto de lei que prioriza o
atendimento de pessoas com problemas renais e pessoas transplantadas no
Estado e dá outras providências; e ao projeto de lei que dispõe sobre a
oferta de absorventes higiênicos nas escolas públicas, nas unidades
básicas de saúde, nas unidades e abrigos e nas unidades prisionais, em
âmbito estadual, e dá outras providências.",19,2021-08-17 10:00:00
000000379,46727,DEPUTADA ANA PAULA SIQUEIRA,19150,2021-08-17 10:00:00,"Comenta a aprovação do projeto de lei que institui o institui o Dia do
Policial Militar Feminino. Defende que poderia ter sido dada uma
demonstração de avanço, caso houvesse sido aprovado texto contendo uma
pequena correção, sinalizando o Dia Estadual da Policial Militar.
Parabeniza a deputada Leninha pelo seu aniversário e pela aprovação do
projeto de lei de sua autoria que dispõe sobre a oferta de absorventes
higiênicos nas escolas públicas, nas unidades básicas de saúde, nas
unidades e abrigos e nas unidades prisionais, em âmbito estadual, e dá
outras providências.",19,2021-08-17 10:00:00
000000380,46728,DEPUTADA LENINHA,26153,2021-08-17 10:00:00,"Agradece a aprovação do projeto de lei de sua autoria que dispõe sobre a
oferta de absorventes higiênicos nas escolas públicas, nas unidades
básicas de saúde, nas unidades e abrigos e nas unidades prisionais, em
âmbito estadual, e dá outras providências. Comenta a aprovação do
projeto de lei que institui o institui o Dia do Policial Militar
Feminino. Lamenta não ter sido aprovado texto contendo uma pequena
correção, sinalizando o Dia Estadual da Policial Militar.",19,2021-08-17 10:00:00
000000381,46729,DEPUTADA ANDRÉIA DE JESUS,26143,2021-08-17 10:00:00,"Declara voto favorável ao projeto de lei que dispõe sobre a oferta de
absorventes higiênicos nas escolas públicas, nas unidades básicas de
saúde, nas unidades e abrigos e nas unidades prisionais, em âmbito
estadual, e dá outras providências. Declara voto favorável ao projeto de
lei que institui o Dia do Policial Militar Feminino. Critica a inversão
na pauta desse projeto, que determinou a apreciação do projeto original
em primeiro lugar, ficando prejudicado o Substitutivo nº 1, cujo parecer
foi aprovado na Comissão das Mulheres, e garantia melhora no texto,
reconhecendo o Dia Estadual da Policial Militar.",19,2021-08-17 10:00:00
000000382,46708,CRISTINA BOVE,,2021-08-13 14:00:00,"Agradece, em nome de toda a população de rua, o anúncio da destinação de
recursos do acordo da Vale para entidades e programas de saúde e
assistência social que atendem a pessoas pobres e carentes.",19,2021-08-13 14:00:00
000000383,46709,MARCO ANTÔNIO VIANA LEITE,,2021-08-13 14:00:00,"Agradece o anúncio da destinação de recursos do acordo da Vale para o
Instituto Mário Penna. Destaca que o dinheiro será essencial para
garantir a continuidade do atendimento pelo Sistema Único de Saúde - SUS
- a pacientes com câncer.",19,2021-08-13 14:00:00
000000384,46710,TEREZA DA GAMA GUIMARÃES PAES,,2021-08-13 14:00:00,"Agradece o anúncio da destinação de recursos do acordo da Vale para o
Hospital da Baleia, destacando que os recursos vão permitir a ampliação
do centro de nefrologia.",19,2021-08-13 14:00:00
000000385,46711,LUIZ HENRIQUE DA SILVA,,2021-08-13 14:00:00,"Agradece o anúncio da destinação de recursos do acordo da Vale para
entidades e programas de saúde e assistência social que atendem a
pessoas pobres e carentes. Destaca que os recursos vão possibilitar a
retomada do pagamento da Bolsa Reciclagem, que beneficia catadores de
materiais recicláveis.",19,2021-08-13 14:00:00
000000386,46712,JOSÉ CRUS,,2021-08-13 14:00:00,"Agradece o anúncio da destinação de recursos do acordo da Vale para
entidades e programas de saúde e assistência social que atendem a
pessoas pobres e carentes. Ressalta que, na Rede Cuidar, os recursos
serão essenciais para garantir o atendimento prestado no âmbito do
Sistema Único de Assistência Social - Suas.",19,2021-08-13 14:00:00
000000387,46713,SANDRA REGINA GOULART DE ALMEIDA,,2021-08-13 14:00:00,"Agradece o anúncio da destinação de recursos do acordo da Vale para a
Universidade Federal de Minas Gerais - UFMG. Destaca a parceria da
Assembleia Legislativa com a universidade desde o início da pandemia de
Covid-19.",19,2021-08-13 14:00:00
000000388,46714,DEPUTADO AGOSTINHO PATRUS,15245,2021-08-13 14:00:00,"Comunica a destinação de recursos do acordo da Vale para entidades e
programas de saúde e assistência social que atendem a pessoas pobres e
carentes. Destaca que o repasse direto de recursos para entidades
assistenciais não estava previsto no acordo original, e esses atores
foram beneficiados graças ao trabalho da Assembleia Legislativa.
Ressalta, ainda, que os recursos vão possibilitar, além da pesquisa para
a produção de vacina contra a Covid-19, a ampliação do atendimento pelo
Sistema Único de Saúde - SUS - nos Hospitais da Baleia e Mário Penna e o
financiamento de ações voltadas para famílias em situação de
vulnerabilidade, população de rua e catadores de materiais recicláveis",19,2021-08-13 14:00:00
000000389,46705,DEPUTADO CHARLES SANTOS,26062,2021-08-12 20:00:00,"Transcurso do 15º aniversário da Lei Federal nº 11.340, de 2006, que
cria mecanismos para coibir a violência doméstica e familiar contra a
mulher, conhecida como Lei Maria da Penha.",19,2021-08-12 20:00:00
000000390,46706,ISABELLA FRANCA OLIVEIRA,,2021-08-12 20:00:00,"Transcurso do 15º aniversário da Lei Federal nº 11.340, de 2006, que
cria mecanismos para coibir a violência doméstica e familiar contra a
mulher, conhecida como Lei Maria da Penha.",19,2021-08-12 20:00:00
000000391,46707,DEPUTADA CELISE LAVIOLA,2267,2021-08-12 20:00:00,"Transcurso do 15º aniversário da Lei Federal nº 11.340, de 2006, que
cria mecanismos para coibir a violência doméstica e familiar contra a
mulher, conhecida como Lei Maria da Penha. Lê pronunciamento oficial do
presidente da Casa, deputado Agostinho Patrus.",19,2021-08-12 20:00:00
000000400,46807,DEPUTADO DUARTE BECHIR,17919,2021-08-11 14:00:00,Comemora a regularização do pagamento dos servidores estaduais.,19,2021-08-11 14:00:00
000000401,46808,DEPUTADA DELEGADA SHEILA,26164,2021-08-11 14:00:00,"Destaca a importância da Lei Maria da Penha, pelo transcurso do
aniversário de 15º ano de sua instituição.",19,2021-08-11 14:00:00
000000402,46809,DEPUTADO MARQUINHO LEMOS,4458,2021-08-11 14:00:00,"Critica o governador Romeu Zema pela falta de investimentos no Vale do
Jequitinhonha.",19,2021-08-11 14:00:00
000000403,46810,DEPUTADO BETÃO,26145,2021-08-11 14:00:00,"Comemora a autorização para funcionamento de um serviço de atenção às
pessoas com doenças raras no Município de Juiz de Fora.",19,2021-08-11 14:00:00
000000404,46811,DEPUTADO DOUTOR JEAN FREIRE,22581,2021-08-11 14:00:00,"Defende a instalação de uma fábrica de baterias de lítio na região do
Vale do Jequitinhonha, solicitando apoio aos deputados.",19,2021-08-11 14:00:00
000000405,46812,DEPUTADO BOSCO,18857,2021-08-11 14:00:00,"Comemora a regularização do pagamento dos servidores estaduais. Informa
sobre a série de eventos dos quais participou com o governador Romeu
Zema no Município de Paracatu. Destaca o lançamento do Plano Integrado
de Preparação e Resposta a Incêndios em Áreas Rurais; a assinatura do
decreto Minas Livre para Crescer; a parceria da Prefeitura de Paracatu
com a Fundação de Arte de Ouro Preto - Faop - para a criação de cursos
técnicos; e a pavimentação da Rodovia LMG-680.",19,2021-08-11 14:00:00
000000406,46813,DEPUTADO CELINHO SINTROCEL,18849,2021-08-11 14:00:00,"Pesar pelo falecimento do Sr. Wagner Gomes, membro do Comitê Central do
Partido Comunista do Brasil - PCdoB - e secretário-geral da Central dos
Trabalhadores
do Brasil - CTB.",19,2021-08-11 14:00:00
000000407,46814,DEPUTADO CLEITINHO AZEVEDO,26101,2021-08-11 14:00:00,"Critica o aumento de tarifas da Companhia de Saneamento de Minas Gerais
- Copasa -, autorizado pela Agência Reguladora de Serviços de
Abastecimento de Água e Esgotamento Sanitário - Arsae-MG -,
principalmente em cidades onde não há tratamento de esgoto.",19,2021-08-11 14:00:00
000000392,46697,DEPUTADO CRISTIANO SILVEIRA,22523,2021-08-11 10:00:00,"Declara posição favorável ao projeto de lei que acrescenta o art.5º-A à
lei que institui a política de atendimento à mulher vítima de violência
no Estado.",19,2021-08-11 10:00:00
